text	author
viva la vita e tutto il mondo	Mr. X
spacchiamo tutto!!	Mr. X
La capra campa ma la gallina muore	Mr. X
Ma che cavolo sto scrivendo? non lo so, ma lo devo fare, purtroppo	Mr. X
Se ci senti batti un colpo, ma non di pistola!	Mr. X
Oibò qual dolce pulzella alberga in questa magione?	Aulico
Sebbene orbo, il mio veder è ancora clarissimo	Aulico
Non tutto il divenir ruota attorno al fulgido astro, che noi appelliamo Sole	Aulico
Lo spaccar dello ligneo bastone risuona fragoroso	Aulico